"Story","Title","Result","Date","Stability","Duration (s)"
"Add article to cart","Add article to cart","SUCCESS","2022-12-29T21:53:13.615788457Z[Etc/UTC]","0.0","8.99"
"Confirm purchase of items added to cart","Confirm the purchase of items added to the cart by adding correct shipping information","SUCCESS","2022-12-29T21:53:22.650640596Z[Etc/UTC]","0.0","4.25"
"Confirm purchase of items added to cart","Try to confirm the purchase without entering the <type_field> in the shipping information","SUCCESS","2022-12-29T21:53:26.928759556Z[Etc/UTC]","0.0","14.86"
"Login to SwagLabs dashboard","Login with valid credentials to <type> user","SUCCESS","2022-12-29T21:53:41.792633847Z[Etc/UTC]","0.0","10.24"
"Login to SwagLabs dashboard","Login with invalid credentials to <type> user","SUCCESS","2022-12-29T21:53:52.038738534Z[Etc/UTC]","0.0","7.73"
